Paper,DOI,Publication Year,Corresponding Author,Email,Physical Address,Analyte Polymer,Critical Component,Architecture,Critical Condition Basis,Column Name,Stationary Phase Chemistry,Column Mode,Pore Size,Column Dimensions,Mobile Phase Solvents,Mobile Phase Ratio,Mobile Phase Ratio Units,Aqueous pH,Aqueous Salt Added,Aqueous Salt Type,Aqueous Salt Concentration,Temperature (°C),Flow Rate,Detector,Consensus Confidence,Qwen Confidence,Mistral Confidence,Evidence: Critical Condition,Evidence: Critical Component,Evidence: Column Name,Evidence: Mobile Phase Solvents,Evidence: Mobile Phase Ratio,Evidence: Temperature,Evidence: Pore Size,Evidence: Flow Rate,Notes
[94] Krüger1996.pdf,,1996,Ralph-Peter Kruger; Helmut Much; Gunter Schulz,,"Institute of Applied Chemistry, Berlin-Adlershof e.V. (ACA) Rudower Chaussee 5 D-12484 Berlin, Germany; Technical University of Berlin, Institute of Technical Chemistry, Str. des 17. Juni 135 D-10623 Berlin, Germany",aliphatic polyesters,,,Liquid Adsorption Chromatography at Critical Conditions (LACCC),,,,,,,,,,False,,,,,MALDI-TOF-MS,explicit,missed,explicit,Liquid Adsorption Chromatography at Critical Conditions (LACCC) of polymers in combination with Matrix-Assisted Laser Desorption / Ionization Time-Of-Flight Mass Spectrometry (MALDI-TOF-MS) and different types of detectors is a very convenient method for the characterization of polymer heterogeneities.,,,,,,,,
[94] Krüger1996.pdf,,1996,Ralph-Peter Kruger; Helmut Much; Gunter Schulz,,"Institute of Applied Chemistry, Berlin-Adlershof e.V. (ACA) Rudower Chaussee 5 D-12484 Berlin, Germany; Technical University of Berlin, Institute of Technical Chemistry, Str. des 17. Juni 135 D-10623 Berlin, Germany",aromatic polyesters,,,Liquid Adsorption Chromatography at Critical Conditions (LACCC),,,,,,,,,,False,,,,,MALDI-TOF-MS,explicit,missed,explicit,Liquid Adsorption Chromatography at Critical Conditions (LACCC) of polymers in combination with Matrix-Assisted Laser Desorption / Ionization Time-Of-Flight Mass Spectrometry (MALDI-TOF-MS) and different types of detectors is a very convenient method for the characterization of polymer heterogeneities.,,,,,,,,
[403] Radke2005.pdf,10.1016/j.polymer.2005.05.028,2005,Wolfgang Radke; Tadeusz Biela,wradke@dki.tu-darmstadt.de; tadek@bilbo.cbmm.lodz.pl,"Deutsches Kunststoff-Institut (German Institute for Polymers), Schlossgartenstr. 6, 64289 Darmstadt, Germany; Department of Polymer Chemistry, Center of Molecular and Macromolecular Studies, Polish Academy of Sciences, Sienkiewicza 112, PL-90-363 Lodz, Poland",Star-shaped poly(lactide)s (PLAs),Linear poly(lactide)s,Linear,Critical conditions determined for linear PLAs,Nucleosil,Bare silica,Normal Phase,100 A and 300 A,0.46 x 20 cm and 0.46 x 25 cm,"1,4-dioxane, n-hexane",57.1/42.9,v/v,,False,,,50,0.5 ml/min,"RI, MALLS, UV, ELS",explicit,explicit,missed,"The critical conditions for linear PLAs with molar masses ranging from 4800 to 26000 g/mol were determined at 50 8C at a composition of 57.1/42.9 (1,4-dioxane/nhexane).",critical conditions determined for linear PLAs,2 bare silica Nucleosil columns,dioxane/n-hexane mixtures,"57.1/42.9 (1,4-dioxane/nhexane)",50 8C,"100 A[˚ ] , 0.46!20 cm, 300 A[˚ ] , 0.46!25 cm",0.5 ml/min,Conditions established for linear PLAs and applied to star-shaped PLAs with various functional groups.
[403] Radke2005.pdf,10.1016/j.polymer.2005.05.028,2005,Wolfgang Radke; Karsten Rode; Alexander V. Gorshkov; Tadeusz Biela,wradke@dki.tu-darmstadt.de; krode@dki.tu-darmstadt.de; avgor@chph.ras.ru; tadek@bilbo.cbmm.lodz.pl,"Deutsches Kunststoff-Institut (German Institute for Polymers), Schlossgartenstr. 6, 64289 Darmstadt, Germany; N.N. Semenov Institute of Chemical Physics, Russian Academy of Sciences, Kosygina 4, 119991 Moscow, Russian Federation; Department of Polymer Chemistry, Center of Molecular and Macromolecular Studies, Polish Academy of Sciences, Sienkiewicza 112, PL-90-363 Lodz, Poland",poly(lactide),linear PLAs,linear,critical conditions determined for linear PLAs,bare silica Nucleosil columns,bare silica,Normal Phase,"100 Å, 300 Å","0.46 x 20 cm, 0.46 x 25 cm","1,4-dioxane, n-hexane",57.1/42.9,v/v,,False,,,50,0.5 ml/min,UV-detector G 1314A,explicit,missed,missed,critical conditions determined for linear PLAs,linear PLAs,bare silica Nucleosil columns,"1,4-dioxane/n-hexane","57.1/42.9 (1,4-dioxane/n-hexane)",50 °C,"100 Å, 300 Å",0.5 ml/min,Conditions established for linear PLAs and applied to star-shaped PLAs with various functional groups.
[148] Wachsen.pdf,,1997,O. Wachen; K. H. Reichert; R. P. Krüger; H. Much; G. Schulz,,"Technical University of Berlin, Institute of Technical Chemistry, Sekr. TC 3, Str. d. 17. Juni 135, D-10623 Berlin, Germany; Institute of Applied Chemistry, Berlin-Adlershof e. V. (ACA), Rudower Chaussee 5, D-12484 Berlin, Germany",oligo-L-lactide,oligo-L-lactide,linear and cyclic oligomers,Liquid Adsorption Chromatography at Critical Conditions (LACCC),Nucleosil 300-S,silica,Normal Phase,,250mm x 4mm ID,"dioxane, n-hexane",60vol.% dioxane and 40vol.% n-hexane,vol.%,,False,,,30,,"Diode-Array-Detector (type UVD 3205, Gynkotek, Germering, Germany) and a UV-detector (type SPD-10A, Shimadzu Europa GmbH, Duisburg, Germany)",explicit,explicit,explicit,The critical conditions of polymer adsorption in the liquid chromatography,oligo-L-lactide,"Nucleosil 300-S column (250mm 4mm ID, Macharey-Nagel, Diuren, Germany)",a mixture of 60vol.% dioxane and 40vol.% n-hexane,a mixture of 60vol.% dioxane and 40vol.% n-hexane,The column was thermostated at 30°C,,,The text explicitly states these are the critical conditions for poly-L-lactide used for LACCC analysis.
[210] Biela2003.pdf,10.1016/S0032-3861(03)00030-2,2003,Andrzej Duda; Harald Pasch,anduda@bilbo.cbmm.lodz.pl; hpasch@dki.tu-darmstadt.de,"Department of Polymer Chemistry, Center of Molecular and Macromolecular Studies, Polish Academy of Sciences, Sienkiewicza 112, PL-90-363 Lodz, Poland; Deutsches Kunststoff-Institut (German Institute for Polymers), Schlossgartenstrasse 6, D-64289 Darmstadt, Germany",linear C4H9-PLA-OH,linear C4H9-PLA-OH,linear,elution volumes independent of molar mass,Si-100 and Si-300,silica gel,Normal Phase,100 and 300 A,,"1,4-dioxane, n-hexane",56.25/43.75,vol%,,False,,,50,0.5 ml/min,Waters 486 tunable UV detector,explicit,missed,missed,"At the critical point of adsorption, a series of linear C4H9-PLA-OH's having molar masses (Mn) in the range from 2.3 × 10³ to 7.4 × 10⁴ ... showed no dependence of the elution volumes on molar mass.",linear C4H9-PLA-OH's,Si-100 and Si-300 (Macherey-Nagel),"mixture of 1,4-dioxane/n-hexane",56.25/43.75 by vol%,50 °C,average pore sizes of 100 and 300 Å,0.5 ml/min,Critical conditions established for linear PLA backbone to analyze star-shaped PLA end-groups.
[210] Biela2003.pdf,10.1016/S0032-3861(03)00030-2,2003,Andrzej Duda; Harald Pasch,anduda@bilbo.cbmm.lodz.pl; hpasch@dki.tu-darmstadt.de,"Department of Polymer Chemistry, Center of Molecular and Macromolecular Studies, Polish Academy of Sciences, Sienkiewicza 112, PL-90-363 Lodz, Poland; Deutsches Kunststoff-Institut (German Institute for Polymers), Schlossgartenstrasse 6, D-64289 Darmstadt, Germany",poly(L-lactide),poly(L-lactide),linear,critical point of adsorption,Si-100 and Si-300,silica gel,Normal Phase,,,"1,4-dioxane, n-hexane",56.25:43.75,vol%,,False,,,50,0.5 ml/min,Waters 486 tunable UV detector operating at 235 nm,explicit,missed,explicit,"For the analysis of the PLA’s LC-CC conditions have been used corresponding to silica gel as the stationary phase and a mixture of 1,4-dioxane/n-hexane (56.25/43.75 by vol%) at 50 8C as the mobile phase.","For the analysis of the PLA’s LC-CC conditions have been used corresponding to silica gel as the stationary phase and a mixture of 1,4-dioxane/n-hexane (56.25/43.75 by vol%) at 50 8C as the mobile phase.",two columns: Si-100 and Si-300 (Macherey-Nagel),"a mixture of 1,4-dioxane and n-hexane",56.25:43.75 vol%,50 8C,,0.5 ml/min,Critical conditions established for linear PLA backbone to analyze star-shaped PLA end-groups.
